{
 "task_id": "REV-0002",
 "role": "security-operation",
 "input_revision": 1,
 "coverage": [
  {
   "question": "A segregação (C-004) é aplicada no servidor e não só no ecrã?",
   "checked": "candidatos r1 e linhas citadas"
  }
 ],
 "findings": [
  {
   "target": "O-001",
   "severity": "blocking",
   "kind": "recommendation",
   "evidence": "matriz-papeis.md#¶2 (C-004)",
   "failure_scenario": "um chefe aprova o próprio pedido se a regra só esconder o botão",
   "closing_condition": "a regra aplicada no servidor e um teste negativo no FC",
   "id": "REV-0002.F01"
  }
 ],
 "assumptions": [],
 "unanswered": [],
 "recommended_actions": [],
 "sources_used": [
  {
   "ref": "_design/candidates.json",
   "sha256": "2c1c94f28124ec106d2c5071c5c507be1e8366e5ab33ffaa91f2baf0364fccce"
  },
  {
   "ref": "shared-understanding.md",
   "sha256": "5c040d4a5f16121fdb8d1e93c40ee88bf2afb0df0d36d4eb92d1c0f1874b1bf2"
  }
 ],
 "schema_version": "handoff-review/1",
 "candidate_revision": 1,
 "mandate_sha256": "494996674c3ac6416ac23c83788ddbdbf3f2fc264404770e623cf2b171a81941",
 "received_at": "2026-09-24T00:07:26Z"
}
