{
 "task_id": "REV-0001",
 "role": "architecture-review",
 "input_revision": 1,
 "coverage": [
  {
   "question": "A forma O-001 aguenta a submissão sem duplicar e a aprovação por papel?",
   "checked": "candidatos r1 e linhas citadas"
  }
 ],
 "findings": [
  {
   "target": "O-001",
   "severity": "material",
   "kind": "recommendation",
   "evidence": "entrevista-processo.md#¶3 (valor por linha)",
   "failure_scenario": "o valor muda conforme a regra de arredondamento escolhida",
   "closing_condition": "regra escolhida pelo dono e fixada no FC do valor",
   "id": "REV-0001.F01"
  }
 ],
 "assumptions": [],
 "unanswered": [],
 "recommended_actions": [],
 "sources_used": [
  {
   "ref": "_design/candidates.json",
   "sha256": "2c1c94f28124ec106d2c5071c5c507be1e8366e5ab33ffaa91f2baf0364fccce"
  },
  {
   "ref": "shared-understanding.md",
   "sha256": "f7f07e49bfdfaabd33b6a8281e8c91dd93173f24f7f3529c584711d1140a359f"
  },
  {
   "ref": "library/packs/pp/architecture-templates/architecture-core.md",
   "sha256": "bec7235958c6b465e9576f8a1c5d331c06817737906d7352988a432735fd591b"
  }
 ],
 "schema_version": "handoff-review/1",
 "candidate_revision": 1,
 "mandate_sha256": "ab2e4c49baff476ddfbf283cc07c39e1c35200467aee2bc89602cf163a399c35",
 "received_at": "2026-09-23T23:05:20Z"
}
